image_id,image_description,frames
194,painting of two girls in yellow dresses dancing in a forest,"frame:CauseToPerceive, frame:Color, frame:BiologicalArea, frame:SelfMotion"
195,a drawing of a castle with a tower and a clock tower,"frame:Buildings, frame:BuildingSubparts, frame:Dimension"
200,a painting of a horse jumping in the air with its front legs spread,"frame:Filling, frame:Dispersal, frame:CauseToPerceive, frame:ChangePositionOnAScale, frame:Assistance, frame:Substance"
201,a painting of a woman sitting in a room with a globe and other objects,"frame:Locale, frame:Posture, frame:CauseToPerceive, frame:BuildingSubparts, frame:People, frame:ChangePosture, frame:Placing, frame:BeingLocated"
202,painting of two people in a canoe with a cat on the water,"frame:CauseToPerceive, frame:People, frame:Vehicle, frame:Animals, frame:Substance"
203,arafed painting of a group of men sitting around a table,"frame:Posture, frame:Aggregate, frame:CauseToPerceive, frame:ChangePosture, frame:Placing, frame:Organization, frame:BeingLocated"
204,painting of a group of people standing around a child,"frame:Posture, frame:Aggregate, frame:CauseToPerceive, frame:People, frame:PeopleByAge, frame:ChangePosture, frame:Placing, frame:Organization, frame:BeingLocated"
205,a painting of a large group of people standing around a stage,"frame:Posture, frame:Aggregate, frame:Dimension, frame:TimePeriodOfAction, frame:CauseToPerceive, frame:People, frame:Size, frame:ChangePosture, frame:Placing, frame:Organization, frame:BeingLocated"
206,a painting of a crucif with three people and a bird,"frame:CauseToPerceive, frame:People"
207,a painting of a woman holding a baby and two children,"frame:CauseToPerceive, frame:People, frame:PeopleByAge"
208,a painting of a woman holding a baby in her arms,"frame:Possession, frame:Containing, frame:CauseToPerceive, frame:People, frame:PeopleByAge, frame:Inclusion, frame:Manipulation"
209,a painting of jesus is surrounded by angels and other people,"frame:CauseToPerceive, frame:People, frame:LocativeRelation, frame:Besieging"
210,arafed painting of a group of people in a courtyard,"frame:Aggregate, frame:CauseToPerceive, frame:Organization, frame:People, frame:LocaleByUse"
211,a painting of a woman with a bird in her hand,"frame:CauseToPerceive, frame:People, frame:ObservableBodyParts"
212,a painting of a woman holding a baby in her lap,"frame:Possession, frame:Containing, frame:CauseToPerceive, frame:People, frame:ObservableBodyParts, frame:PeopleByAge, frame:Inclusion, frame:Manipulation"
213,a painting of a man holding a baby and a woman holding a baby,"frame:CauseToPerceive, frame:People, frame:PeopleByAge"
214,a painting of a man with a black hat and a flower,"frame:Accoutrements, frame:Color, frame:CauseToPerceive, frame:People, frame:Progress"
215,a painting of a man holding a baby and a woman holding a child,"frame:CauseToPerceive, frame:People, frame:PeopleByAge"
216,a painting of a woman holding a child and a baby,"frame:CauseToPerceive, frame:People, frame:PeopleByAge"
217,painting of a couple of women and a child in a garden,"frame:CauseToPerceive, frame:LocaleByUse, frame:PersonalRelationship, frame:PeopleByAge"
218,a painting of a woman with a cat in her lap,"frame:CauseToPerceive, frame:People, frame:ObservableBodyParts, frame:Animals"
219,a painting of a woman holding a brush and a palette,"frame:BiologicalArea, frame:Diversity, frame:CauseToPerceive, frame:Scope, frame:People"
220,a painting of a woman and two men with a horse,"frame:CauseToPerceive, frame:Assistance, frame:People"
221,a painting of a man on a horse being held by a woman,"frame:CauseToPerceive, frame:Assistance, frame:People"
222,a painting of a woman in a black dress with a white collar,"frame:Color, frame:ClothingParts, frame:CauseToPerceive, frame:People, frame:Clothing"
223,a painting of a naked man and a naked woman laying on a rock,"frame:Wearing, frame:CauseToPerceive, frame:People, frame:CauseHarm, frame:Placing"
224,a painting of a group of people standing around a tree,"frame:Posture, frame:Aggregate, frame:BiologicalArea, frame:CauseToPerceive, frame:People, frame:ChangePosture, frame:Placing, frame:Organization, frame:BeingLocated"
225,a painting of a woman in a red dress and white dress,"frame:CauseToPerceive, frame:Color, frame:People, frame:Clothing"
226,a painting of a man is being taken out of a room by a woman,"frame:Cotheme, frame:EarningsAndLosses, frame:ChangeOfLeadership, frame:Conquering, frame:CauseToPerceive, frame:BuildingSubparts, frame:People, frame:Bringing, frame:Getting, frame:Removing, frame:Taking, frame:ChangeOfQuantityOfPossession"
227,a painting of a woman in a purple dress standing under a tree,"frame:BiologicalArea, frame:Color, frame:CauseToPerceive, frame:People, frame:OccupyRank, frame:Clothing"
228,a painting of a group of naked women in the water,"frame:Aggregate, frame:Wearing, frame:CauseToPerceive, frame:Substance, frame:Organization"
229,painting of a woman and a dog in a room,"frame:CauseToPerceive, frame:BuildingSubparts, frame:People, frame:Animals"
230,a painting of a house in a field with mountains in the background,"frame:CauseToPerceive, frame:Buildings"
231,painting of a goat with a hat and a woman with a flower,"frame:CauseToPerceive, frame:People, frame:Progress, frame:Accoutrements"
232,painting of a couple sitting on a rock by the water,"frame:Posture, frame:CauseToPerceive, frame:CauseHarm, frame:ChangePosture, frame:Substance, frame:Placing, frame:PersonalRelationship, frame:BeingLocated"
233,a painting of a dog laying on a table next to a clock,"frame:CauseToPerceive, frame:Placing, frame:Animals, frame:Dimension"
244,a man with a mustache and a black jacket on a poster,"frame:Color, frame:People, frame:ObservableBodyParts, frame:Attaching, frame:Clothing"
247,arafed little girl sitting in a chair with a banana in her hand,"frame:Posture, frame:Dimension, frame:Food, frame:ObservableBodyParts, frame:Size, frame:ChangePosture, frame:Placing, frame:BeingLocated"
251,a close up of a person wearing pink pants and a denim jacket,"frame:Clothing, frame:People, frame:Color"
252,a close up of a man adjusting his tie with a quote,"frame:Adjusting, frame:Clothing, frame:Compliance, frame:People"
253,a close up of a panda bear sitting on a tree branch,"frame:Posture, frame:BiologicalArea, frame:BeingLocated, frame:ChangePosture, frame:Placing"
254,a couple of people sitting on the floor in a living room,"frame:Posture, frame:BuildingSubparts, frame:People, frame:ArchitecturalPart, frame:ChangePosture, frame:Placing, frame:PersonalRelationship, frame:BeingLocated"
257,a close up of a cup of ice cream with a warning sign,"frame:Sign, frame:CauseTemperatureChange, frame:Choosing, frame:InchoativeChangeOfTemperature, frame:Containers"
260,arafed woman smoking a cigarette with a cigarette in her mouth,"frame:Intoxicants, frame:IngestSubstance, frame:ShapedPart, frame:People, frame:ObservableBodyParts"
262,skier doing a flip on a snowy mountain with skis,"frame:Travel, frame:Motion, frame:NaturalFeatures"
263,a man in a ski mask with a lime in his mouth,"frame:Travel, frame:Accoutrements, frame:Motion, frame:ShapedPart, frame:People, frame:ObservableBodyParts"
264,a close up of a person holding a stick near a casino table,"frame:Gizmo, frame:People"
266,there is a woman sitting on the floor with a cell phone,"frame:Posture, frame:CommunicationMeans, frame:Contacting, frame:People, frame:ArchitecturalPart, frame:ChangePosture, frame:Substance, frame:Placing, frame:BeingLocated"
269,there is a woman standing in a room with a cat on the floor,"frame:BuildingSubparts, frame:People, frame:OccupyRank, frame:Animals, frame:ArchitecturalPart"
270,cartoon cat with a mouse on its back and a washing machine,"frame:Gizmo, frame:BeingEmployed, frame:WorkingOn, frame:ObservableBodyParts, frame:Animals, frame:LaborProduct, frame:CreateRepresentation"
272,a black and white photo of a man standing in front of a poster,"frame:Color, frame:Representing, frame:PartOrientational, frame:People, frame:Attaching, frame:OccupyRank"
273,a man wearing a mask with blood on it and a green background,"frame:Accoutrements, frame:Filling, frame:Color, frame:People, frame:Placing"
275,a close up of a man with chains on his chest,"frame:People, frame:ObservableBodyParts, frame:PartWhole"
276,arafed man flying through the air while holding onto a string,"frame:Motion, frame:People, frame:Bringing, frame:SelfMotion, frame:Connectors, frame:OperateVehicle, frame:Substance, frame:RideVehicle"
277,smoke coming out of two smoking stacks with the words stop burning your life,"frame:CommercePay, frame:Emitting, frame:Halt, frame:ShootProjectiles, frame:Arriving, frame:Existence, frame:ActivityStop, frame:ProcessStop"
278,arafed advertiser of a polar bear in the water,"frame:Substance, frame:JudgmentCommunication"
281,there is a woman standing in front of a wall with a gun,"frame:Posture, frame:BeingLocated, frame:PartOrientational, frame:People, frame:ArchitecturalPart, frame:ChangePosture, frame:Weapon, frame:Placing"
282,a close up of a glass grenade shaped object on a white background,"frame:Color, frame:Reshaping, frame:IntentionallyCreate, frame:CauseChange, frame:Substance, frame:Weapon, frame:ManipulateIntoShape"
287,"cartoon cat with mouse on back of it's back, sitting on a floor","frame:Posture, frame:WorkingOn, frame:ObservableBodyParts, frame:Animals, frame:ArchitecturalPart, frame:ChangePosture, frame:LaborProduct, frame:Placing, frame:CreateRepresentation, frame:BeingLocated"
288,arafed man in a gas mask sitting on a motorcycle,"frame:Posture, frame:RideVehicle, frame:Accoutrements, frame:People, frame:OperateVehicle, frame:Substance, frame:ChangePosture, frame:Placing, frame:BeingLocated"
289,an elephant smoking a cigarette with a cat sitting on a bed,"frame:Posture, frame:BeingLocated, frame:Intoxicants, frame:BuildingSubparts, frame:Animals, frame:ChangePosture, frame:Supply, frame:Causation, frame:Placing"
290,a close up of a cartoon snake with a man in a desert,
291,a poster with a picture of a man sitting on a rock,
292,a black and white drawing of a city with lots of buildings,
294,there is a young boy standing in a bathroom with a towel on his head,
295,a cartoon boat with a man on it floating in the water,"frame:Motion, frame:WorkingOn, frame:People, frame:Vehicle, frame:LaborProduct, frame:Substance, frame:CreateRepresentation"
297,a black and white photo of a hand grenade with a quote on it,"frame:Color, frame:Weapon, frame:Representing, frame:ObservableBodyParts"
299,arafed woman in white dress sitting on a chair next to a piano,"frame:Posture, frame:Color, frame:People, frame:Clothing, frame:ChangePosture, frame:NoiseMakers, frame:Placing, frame:BeingLocated"
300,a couple of little girls standing next to each other in school uniforms,"frame:Posture, frame:PersonalRelationship, frame:Dimension, frame:Size, frame:ChangePosture, frame:Placing, frame:LocaleByUse, frame:BeingLocated"
302,a close up of a person holding a rope with a plant in it,"frame:Connectors, frame:People, frame:LocaleByUse"
306,reality check climate change and the tar sands,"frame:Filling, frame:Weather, frame:Creating, frame:Adorning, frame:UndergoChange, frame:CauseChange"
308,a poster with a wine cork and a piece of wine,"frame:Intoxicants, frame:Creating, frame:PartWhole, frame:Attaching, frame:Building"
309,a picture of a group of orange and white cones sitting on top of a cement floor,"frame:Posture, frame:Aggregate, frame:Filling, frame:Color, frame:Adorning, frame:Sensation, frame:OpticalImage, frame:Attaching, frame:ArchitecturalPart, frame:ChangePosture, frame:Supply, frame:Placing, frame:Organization, frame:BeingLocated"
310,a close up of a television screen with a line of cups and an apple,"frame:PartInnerOuter, frame:Food, frame:Pattern"
311,a group of people are standing around a burning fire,"frame:Posture, frame:Aggregate, frame:Event, frame:People, frame:ChangePosture, frame:Placing, frame:Organization, frame:BeingLocated"
314,a man with a bruised face and a black shirt,"frame:Color, frame:People, frame:ObservableBodyParts, frame:CauseHarm, frame:Clothing, frame:FacialExpression"
317,there is a red sign with a picture of a car and a truck,"frame:Sign, frame:Color, frame:Sensation, frame:OpticalImage, frame:Vehicle"
318,there is a man standing on a fence with a dog,"frame:Posture, frame:People, frame:Protecting, frame:Animals, frame:ChangePosture, frame:Placing, frame:BeingLocated"
319,surfer standing on the beach with his surfboard under a stormy sky,"frame:Locale, frame:Weather, frame:NaturalFeatures, frame:Motion, frame:OccupyRank"
321,someone holding a cigarette and a cigarette lighter in their hand,"frame:Intoxicants, frame:SettingFire, frame:Possession, frame:Containing, frame:ObservableBodyParts, frame:Inclusion, frame:Manipulation"
322,a woman in a bikini and goggles in the water with sharks,"frame:Clothing, frame:Substance, frame:People, frame:Accoutrements"
326,arafed poster of a man holding a gun in front of a brick wall,"frame:Possession, frame:Containing, frame:PartOrientational, frame:People, frame:Attaching, frame:ArchitecturalPart, frame:Inclusion, frame:Manipulation, frame:Weapon"
329,a poster with a number of letters and numbers on it,"frame:Quantity, frame:Attaching"
331,two pictures of a field with a dirt road and a sign that says est - ion,"frame:TextCreation, frame:Sign, frame:Communication, frame:Statement, frame:Roadways, frame:Request, frame:CauseChange, frame:Substance"
332,arafed man in the ocean with a kite attached to his back,"frame:People, frame:ObservableBodyParts, frame:NaturalFeatures"
334,a close up of a car with its hood open and the hood open,"frame:Openness, frame:PeopleByMorality, frame:Vehicle"
338,arafed clock with a reflection of a man in it,"frame:People, frame:Dimension"
339,a silhouette of a woman running with a hat and a hair dryer,"frame:BecomingDry, frame:Accoutrements, frame:UndergoChange, frame:OpticalImage, frame:HairConfiguration, frame:ObservableBodyParts, frame:People, frame:SelfMotion, frame:CauseToBeDry"
340,a close up of a hand holding a green octopus with a red background,"frame:Color, frame:ObservableBodyParts"
342,a couple of bottles of dove body wash sitting next to each other,"frame:Posture, frame:Filling, frame:PartWhole, frame:ChangePosture, frame:Placing, frame:PersonalRelationship, frame:BeingLocated"
343,a magazine with a boy reading a book with a shoe on top of it,"frame:Posture, frame:Text, frame:PartOrderedSegments, frame:Clothing, frame:Supply, frame:BeingLocated"
344,cartoon of a woman falling off a bike while riding a bike,"frame:CreateRepresentation, frame:Travel, frame:MotionDirectional, frame:WorkingOn, frame:People, frame:Vehicle, frame:OperateVehicle, frame:LaborProduct, frame:RideVehicle"
346,a painting of a woman laying on a bench with a sunbath,"frame:CauseToPerceive, frame:People, frame:Placing"
348,a close up of a man with a bandage on his face,"frame:People, frame:FacialExpression, frame:ObservableBodyParts"
349,arafed scorpion with a red tail and a black body,"frame:Color, frame:ObservableBodyParts, frame:PartWhole"
351,arafed truck with a load of lumber on the back of it,"frame:ObservableBodyParts, frame:Vehicle, frame:Filling, frame:Placing"
353,a man leaning against a fence with flowers in his hand,"frame:Posture, frame:MotionDirectional, frame:PathShape, frame:People, frame:Protecting, frame:ObservableBodyParts, frame:ChangePosture"
355,arafed turtle being fed by a person with a hair dryer,"frame:BecomingDry, frame:UndergoChange, frame:Ingestion, frame:People, frame:ObservableBodyParts, frame:CauseToBeDry, frame:Giving, frame:Capacity, frame:HairConfiguration"
356,arafed image of a car driving on a road with a snow plow,"frame:Gizmo, frame:CauseMotion, frame:Roadways, frame:Bringing, frame:Awareness, frame:Precipitation, frame:SelfMotion, frame:Vehicle, frame:OperateVehicle, frame:RideVehicle"
359,a man with a fox head and a black background,"frame:Color, frame:People, frame:ObservableBodyParts"
360,"arafed man in a black shirt leaning on a table with a sign that says, if","frame:TextCreation, frame:Posture, frame:Sign, frame:Communication, frame:Statement, frame:MotionDirectional, frame:Color, frame:PathShape, frame:Request, frame:People, frame:Clothing, frame:ChangePosture"
365,a close up of a person holding a cigarette in their hand,"frame:Intoxicants, frame:Possession, frame:Containing, frame:People, frame:ObservableBodyParts, frame:Inclusion, frame:Manipulation"
370,a cartoon of a man with a devil head and a devil tail on a skateboard,"frame:WorkingOn, frame:People, frame:ObservableBodyParts, frame:OperateVehicle, frame:LaborProduct, frame:CreateRepresentation, frame:ReligiousBelief"
374,a picture taken from a canadian postcard with a tire and a canadian flag,"frame:HaveAsRequirement, frame:Communication, frame:Filling, frame:TakingTime, frame:Adorning, frame:Sensation, frame:Gesture, frame:OpticalImage, frame:RequiredEvent, frame:Needing"
375,a video game with a video of a waterfall and a waterfall,"frame:IntentionallyAct, frame:NaturalFeatures"
382,a group of cigarettes with the words no smoking written on them,"frame:Aggregate, frame:TextCreation, frame:SpellingAndPronouncing, frame:Organization"
383,arafed man holding a drum in a parking garage with a woman,"frame:Possession, frame:Containing, frame:People, frame:Inclusion, frame:Manipulation, frame:NoiseMakers, frame:Buildings"
385,a close up of a cigarette with a cigarette stick on it,"frame:Gizmo, frame:Intoxicants"
392,araffe taking a picture of a woman laying on a blanket in the grass,"frame:Cotheme, frame:Filling, frame:Adorning, frame:Sensation, frame:ChangeOfLeadership, frame:Conquering, frame:OpticalImage, frame:EarningsAndLosses, frame:People, frame:Bringing, frame:Getting, frame:Removing, frame:Placing, frame:Taking, frame:ChangeOfQuantityOfPossession"
393,there is a truck and a car parked in a parking lot,"frame:Quantity, frame:Aggregate, frame:Vehicle, frame:Placing"
395,a poster of a cactus with a man's face and arms,"frame:People, frame:FacialExpression, frame:Attaching, frame:ObservableBodyParts"
396,araffes with a man and a lion in a field,frame:People
400,two pictures of a scorpion on a rock with a black tail,"frame:Color, frame:ObservableBodyParts, frame:CauseHarm"
401,a close up of a syll with a needle sticking out of it,"frame:Gizmo, frame:CauseMotion, frame:InchoativeAttaching, frame:Attaching, frame:BeingAttached, frame:Placing"
403,there is a poster with a motorcycle and a bottle of beer,"frame:Food, frame:Attaching, frame:OperateVehicle, frame:MeasureVolume, frame:Containers, frame:RideVehicle"
405,arafed man in a bathing suit standing on a toilet in a bathroom,"frame:Posture, frame:BeingLocated, frame:BuildingSubparts, frame:People, frame:Clothing, frame:Placing, frame:ChangePosture, frame:Buildings"
406,a close up of a cloud with a city in the background,"frame:PoliticalLocales, frame:LocaleByUse"
407,a poster of a naked woman with a bunch of fake hair,"frame:Aggregate, frame:Artificiality, frame:Wearing, frame:People, frame:ObservableBodyParts, frame:Attaching, frame:HairConfiguration"
409,a cartoon image of a man and a gorilla in a desert,"frame:BiologicalArea, frame:WorkingOn, frame:People, frame:Awareness, frame:LaborProduct, frame:CreateRepresentation"
410,"an advertisement for north america group agate, a company that sells roofing materials","frame:Aggregate, frame:CommerceSell, frame:PartOrientational, frame:Businesses, frame:Organization"
411,a close up of a sign with a bee on it,frame:Sign
412,a white poster with a picture of a volkswagen logo and words,"frame:OpticalImage, frame:Color, frame:Attaching, frame:Sensation"
415,arafed man jumping over a stool in a room,"frame:BuildingSubparts, frame:People, frame:ChangePositionOnAScale"
418,a close up of a cigarette with the word downloading cancer on it,"frame:SimpleName, frame:MedicalConditions, frame:Intoxicants"
419,a woman holding a picture of a man and a woman,"frame:OpticalImage, frame:People, frame:Sensation"
421,a poster with a heart and a key on it,"frame:Gizmo, frame:Opinion, frame:Awareness, frame:Attaching, frame:Damaging"
423,barbed wire fence with water droplets on top of it,"frame:Posture, frame:Protecting, frame:Connectors, frame:Supply, frame:Substance, frame:BeingLocated"
425,arafed chicken in colorado with a message on it,"frame:Food, frame:PoliticalLocales"
431,chewbac playing baseball isn't normal but on meth is,"frame:Intoxicants, frame:Typicality"
432,a picture taken from a movie showing a man in a prison,"frame:HaveAsRequirement, frame:Creating, frame:TakingTime, frame:IntentionallyCreate, frame:BehindTheScenes, frame:CauseToPerceive, frame:RequiredEvent, frame:Needing, frame:People, frame:Prison"
435,a close up of a smiley face with a smile drawn on it,"frame:CreateRepresentation, frame:IntentionallyCreate, frame:CreatePhysicalArtwork, frame:Motion, frame:ObservableBodyParts, frame:FacialExpression"
436,a close up of a white and blue elephant on a pink background,frame:Color
437,a black and white photo of a rocket launching into the air,"frame:Color, frame:Substance, frame:Representing, frame:Vehicle"
439,a woman in a red dress is playing with a white tiger,"frame:Competition, frame:Color, frame:People, frame:Clothing"
441,there is a can of soda next to a garbage can,"frame:Capability, frame:Preserving, frame:IntentionallyCreate, frame:CauseHarm, frame:MeasureVolume, frame:Containers"
442,there is a mouse that is walking past a bunch of cheese,"frame:Cotheme, frame:Food, frame:Aggregate, frame:SelfMotion"
443,a black and white photo of a cigarette with smoke coming out of it,"frame:Emitting, frame:Intoxicants, frame:Color, frame:Arriving, frame:Representing"
445,"a poster for the environmental campaign, the water is in the hourglass","frame:Substance, frame:Attaching"
447,"a poster for the movie, the jungle","frame:BehindTheScenes, frame:IntentionallyCreate, frame:Attaching, frame:Creating"
449,arafed advertisement of a man and woman smoking cigarettes,frame:People
450,a red marker is circled on a page of a website,"frame:Color, frame:Sign"
452,volkswagen print advert featuring a car and a pig balloon,"frame:OperateVehicle, frame:Animals, frame:Vehicle"
453,a picture of a car is shown in an advertisement for the new kia,"frame:Familiarity, frame:Sensation, frame:CauseToPerceive, frame:OpticalImage, frame:Vehicle"
456,"a woman with a cigarette in her hand saying, because smoking i've had about 20 amp","frame:TextCreation, frame:Communication, frame:Intoxicants, frame:Statement, frame:Ingestion, frame:Request, frame:People, frame:ObservableBodyParts, frame:CardinalNumbers"
459,a close up of a cell phone with a black background,"frame:Color, frame:Substance, frame:Contacting, frame:CommunicationMeans"
461,a man playing pool with a giant alien figure,"frame:Competition, frame:Dimension, frame:People, frame:Size, frame:PeopleByOrigin"
463,there is a sign that says preserve the world preserve the world,"frame:Preserving, frame:Locale, frame:Sign, frame:IntentionallyCreate, frame:Possession, frame:ActivityOngoing"
464,a close up of a large alligator laying in a puddle of water,"frame:NaturalFeatures, frame:Dimension, frame:Size, frame:Substance, frame:Placing"
467,twisted limbs ii - fear of the dark,"frame:Fear, frame:CardinalNumbers"
469,a woman with a snake on her shoulder in front of a black background,"frame:Color, frame:PartOrientational, frame:ObservableBodyParts, frame:People"
474,a close up of a bird with a long neck and a long tail,"frame:ObservableBodyParts, frame:DurationAttribute"
475,there is a clock with a sculpture of a bear on it,"frame:PhysicalArtworks, frame:Dimension"
476,arafed image of a car mirror with a picture of a man in a rain storm,"frame:Weather, frame:Sensation, frame:OpticalImage, frame:People, frame:Awareness, frame:Vehicle, frame:Precipitation"
478,there is a baby reaching for a pan in the kitchen,"frame:Arriving, frame:PathShape, frame:BuildingSubparts, frame:ChangePositionOnAScale, frame:PeopleByAge, frame:Giving, frame:Passing"
479,arafed woman in a bikini with a dog in a field,"frame:Clothing, frame:People, frame:Animals"
480,arafed image of a man jumping over a street light,"frame:LocationOfLight, frame:Roadways, frame:People, frame:Awareness, frame:SelfMotion, frame:Traversing"
481,a blue and white advertisement with a spider and a spider eye,"frame:Color, frame:ObservableBodyParts"
482,a poster with a hand holding a snake's mouth with its teeth,"frame:ShapedPart, frame:ObservableBodyParts, frame:Attaching"
484,there is a snowboard with a plant sticking out of it,"frame:CauseMotion, frame:InchoativeAttaching, frame:Attaching, frame:BeingAttached, frame:LocaleByUse, frame:Placing"
485,a group of women in saris and dresses are posing for a picture,"frame:Aggregate, frame:PosingAs, frame:Sensation, frame:OpticalImage, frame:Feigning, frame:Organization"
486,nike print ad featuring a snake and a shoe,frame:Clothing
487,a picture taken from a movie showing a man in a prison,"frame:HaveAsRequirement, frame:Creating, frame:TakingTime, frame:IntentionallyCreate, frame:BehindTheScenes, frame:CauseToPerceive, frame:RequiredEvent, frame:Needing, frame:People, frame:Prison"
488,two pictures of a couple of people that are on their cell phones,"frame:Substance, frame:People, frame:PersonalRelationship"
490,a close up of two cigarettes with smoke coming out of them,"frame:Arriving, frame:Emitting"
491,a woman with a cigarette in her mouth and a cigarette in her mouth,"frame:ShapedPart, frame:People, frame:ObservableBodyParts, frame:Intoxicants"
493,a close up of a sign with sauce on it that says saw,"frame:TextCreation, frame:Sign, frame:Communication, frame:Statement, frame:Food, frame:Request"
