image_id,image_description,frames
494,a poster for the movie stop,"frame:Creating, frame:IntentionallyCreate, frame:BehindTheScenes, frame:Attaching, frame:TemporaryStay"
497,a close up of a burnt piece of paper with a picture of a man,"frame:Ingredients, frame:Filling, frame:Creating, frame:Sensation, frame:OpticalImage, frame:People, frame:PartWhole, frame:Substance, frame:Building"
501,a man sitting in a shopping cart in a parking lot at night,"frame:Shopping, frame:Posture, frame:Aggregate, frame:CalendricUnit, frame:Quantity, frame:People, frame:Bringing, frame:ChangePosture, frame:Placing, frame:BeingLocated"
503,arafed man sitting on the ground with a knife in his mouth,"frame:Posture, frame:NaturalFeatures, frame:ShapedPart, frame:People, frame:ObservableBodyParts, frame:ChangePosture, frame:Placing, frame:Weapon, frame:BeingLocated"
504,a close up of a bottle of absolut frankenstein on a table,"frame:MeasureVolume, frame:Containers"
505,arafed image of a group of men and women posing for a picture,"frame:Aggregate, frame:PosingAs, frame:Sensation, frame:Feigning, frame:OpticalImage, frame:Awareness, frame:Organization"
506,a woman driving a car with a cell phone in her hand,"frame:CauseMotion, frame:CommunicationMeans, frame:Contacting, frame:People, frame:Bringing, frame:ObservableBodyParts, frame:Vehicle, frame:SelfMotion, frame:OperateVehicle, frame:Substance, frame:RideVehicle"
508,a close up of a laptop with a person on it,frame:People
510,arafed woman smoking a cigarette with a red background,"frame:IngestSubstance, frame:People, frame:Color, frame:Intoxicants"
512,arafed for me - the pepsi advertises the pepsi brand,"frame:OperateVehicle, frame:Bringing"
516,a black and white advertisement for a chocolate bar with cartoon characters,"frame:Color, frame:WorkingOn, frame:LaborProduct, frame:CreateRepresentation, frame:Buildings"
520,arafed image of a car that has been smashed into pieces,"frame:CauseToFragment, frame:Awareness, frame:Vehicle, frame:Impact, frame:CauseHarm"
522,smoke coming out of a lung with a cigarette in the middle,"frame:PartInnerOuter, frame:Arriving, frame:Emitting, frame:Intoxicants"
526,arafed man holding a fishing rod in front of a boat,"frame:Gizmo, frame:Possession, frame:Containing, frame:PartOrientational, frame:People, frame:Vehicle, frame:Inclusion, frame:Manipulation"
528,a close up of a person on a surfboard in the water,"frame:People, frame:Substance"
530,arafed water tower with a cow statue on top of it,"frame:BuildingSubparts, frame:PartOrientational, frame:Animals, frame:PhysicalArtworks, frame:Substance, frame:Buildings"
533,a man in a suit standing next to a silver car,"frame:Posture, frame:People, frame:Vehicle, frame:Clothing, frame:Placing, frame:ChangePosture, frame:BeingLocated"
535,a close up of a bottle of hennessy next to glasses of wine,"frame:MeasureVolume, frame:Containers, frame:RelativeTime, frame:Intoxicants"
536,a black and white photo of a woman in a bathing suit,"frame:Color, frame:People, frame:Representing, frame:Clothing"
537,arafed advertisement of a red car in a parking lot,"frame:Quantity, frame:Color, frame:Aggregate, frame:Vehicle"
540,a close up of a spiral shaped object with a snake on it,frame:CauseChange
541,a black and white photo of a radio with a sign on it,"frame:Color, frame:Sign, frame:Representing"
542,a close up of a white volkswagen advertisement with a blue sticker,frame:Color
543,a close up of a man in a boxing ring with a rope,"frame:Connectors, frame:People"
544,a close up of a lizard with a lizard like face and a plant in a glass container,"frame:ObservableBodyParts, frame:Containers, frame:Substance, frame:FacialExpression, frame:LocaleByUse"
545,a man standing in the water with a rainbow in the background,"frame:People, frame:Substance, frame:OccupyRank"
550,a close up of a person standing next to a burrito,"frame:Posture, frame:People, frame:ChangePosture, frame:Placing, frame:BeingLocated"
551,there is a teddy bear sitting on the ground in front of a building,"frame:Posture, frame:BeingLocated, frame:NaturalFeatures, frame:PartOrientational, frame:ChangePosture, frame:Placing, frame:Buildings"
553,a close up of a black and white photo of a mouth with teeth,"frame:ShapedPart, frame:Color, frame:ObservableBodyParts, frame:Representing"
556,a close up of a boat on a beach near the ocean,"frame:Vehicle, frame:NaturalFeatures"
559,a cartoon of a car driving down a street with a man on the side,"frame:CreateRepresentation, frame:CauseMotion, frame:WorkingOn, frame:People, frame:Bringing, frame:Willingness, frame:Vehicle, frame:SelfMotion, frame:Roadways, frame:OperateVehicle, frame:LaborProduct, frame:RideVehicle"
560,a cartoon man holding a chainsaw in a room with a sign,"frame:Sign, frame:Possession, frame:Containing, frame:WorkingOn, frame:BuildingSubparts, frame:People, frame:Inclusion, frame:Manipulation, frame:LaborProduct, frame:CreateRepresentation"
562,a man riding a lawn mower in front of a white picket fence,"frame:Closure, frame:Travel, frame:Color, frame:InchoativeAttaching, frame:PartOrientational, frame:Protecting, frame:People, frame:Attaching, frame:OperateVehicle, frame:RideVehicle"
563,arafed man on a skateboard in a living room with a magazine,"frame:OperateVehicle, frame:BuildingSubparts, frame:People, frame:Text"
564,arafed baby hanging from a rope with a sign saying dareds are born loving fear,"frame:ExperiencerFocus, frame:TextCreation, frame:Sign, frame:Connectors, frame:Communication, frame:Statement, frame:Creating, frame:IntentionallyCreate, frame:CauseToStart, frame:Birth, frame:PeopleByAge, frame:Fear, frame:Request"
566,arafed image of a man standing on a bridge with a sign in the background,"frame:Posture, frame:Sign, frame:Roadways, frame:People, frame:Awareness, frame:ChangePosture, frame:Placing, frame:BeingLocated"
568,a bottle of beer with a small amount of water on it,"frame:Dimension, frame:AmountingTo, frame:Food, frame:Size, frame:Containers, frame:MeasureVolume, frame:Substance"
570,a white horse standing next to a car with a white horse on it,"frame:Posture, frame:Color, frame:Vehicle, frame:ChangePosture, frame:Assistance, frame:Placing, frame:BeingLocated"
571,there is a picture of a picture of a vegetable elephant,"frame:OpticalImage, frame:Sensation"
572,a large gorilla standing in front of a red house with a red roof,"frame:Dimension, frame:Color, frame:ArchitecturalPart, frame:PartOrientational, frame:Size, frame:OccupyRank, frame:Buildings"
574,there are two people sitting on the ground watching a fire,"frame:Cotheme, frame:Posture, frame:NaturalFeatures, frame:BeingAwake, frame:Event, frame:Seeking, frame:People, frame:PerceptionActive, frame:Placing, frame:ChangePosture, frame:BeingLocated"
576,a poster for a movie with a car and a woman driving in a car,"frame:CauseMotion, frame:Creating, frame:IntentionallyCreate, frame:BehindTheScenes, frame:People, frame:Bringing, frame:Vehicle, frame:Attaching, frame:SelfMotion, frame:OperateVehicle, frame:RideVehicle"
577,a poster with a cigarette hanging from a hook with a cigarette in it,"frame:Intoxicants, frame:Attaching"
580,a close up of a child standing in a room with a light drawing on the wall,"frame:Dimension, frame:ArchitecturalPart, frame:BuildingSubparts, frame:PeopleByAge, frame:OccupyRank"
581,a poster with a cigarette shaped like lungs and the words smoking causes lung cancer,"frame:Intoxicants, frame:Reshaping, frame:IntentionallyCreate, frame:MedicalConditions, frame:Attaching, frame:Causation, frame:ManipulateIntoShape"
583,a close up of a car with a bottle of liquid on it,"frame:MeasureVolume, frame:Substance, frame:Vehicle, frame:Containers"
584,a poster with a skeleton and a car in the background,"frame:Vehicle, frame:Attaching"
588,"a poster for the movie, the leftover spaghettitti","frame:Creating, frame:IntentionallyCreate, frame:BehindTheScenes, frame:Attaching, frame:Remainder"
589,a close up of a cigarette with a cigarette lighter in the middle,"frame:PartInnerOuter, frame:SettingFire, frame:Intoxicants"
590,a close up of a crocodile's mouth with its mouth open,"frame:ShapedPart, frame:ObservableBodyParts"
592,a poster for the movie alien city,"frame:PeopleByOrigin, frame:Creating, frame:IntentionallyCreate, frame:BehindTheScenes, frame:Attaching, frame:PoliticalLocales, frame:LocaleByUse"
597,a close up of a hedgehog in a bag with goldfish inside,"frame:PartInnerOuter, frame:MeasureVolume, frame:Containers"
599,a picture taken from a magazine with a man pulling a tank,"frame:HaveAsRequirement, frame:CauseMotion, frame:TakingTime, frame:Text, frame:Sensation, frame:OpticalImage, frame:RequiredEvent, frame:Needing, frame:Vehicle, frame:People, frame:Manipulation"
601,a poster of a man driving a car with a gorilla on the dashboard,"frame:CauseMotion, frame:People, frame:Bringing, frame:Vehicle, frame:Attaching, frame:SelfMotion, frame:OperateVehicle, frame:RideVehicle"
603,"several people holding signs that say, you should end in the wrong order",
605,arafed man and child in a car with tools in front of them,
609,a close up of a tall tower with a lot of moss on it,
611,a close up of two cars with the words don't drink and drive,
612,arafed man in a mask holding a sign that says you see better when you're,"frame:Desirability, frame:PerceptionExperience, frame:TextCreation, frame:Sign, frame:Communication, frame:Accoutrements, frame:Statement, frame:People, frame:Request"
621,araff is a man with a lot of bees on his hands,"frame:Quantity, frame:People, frame:Aggregate"
622,a close up of a syet with a can of mountain dew next to it,"frame:MeasureVolume, frame:Containers, frame:NaturalFeatures"
623,arafed car on the street with a bicycle on the side of it,"frame:Roadways, frame:Vehicle"
625,a person pointing at a sign that says texting while driving,"frame:TextCreation, frame:Sign, frame:CauseMotion, frame:Communication, frame:Statement, frame:Evidence, frame:CauseToPerceive, frame:People, frame:Request, frame:Bringing, frame:SelfMotion, frame:OperateVehicle, frame:Adducing, frame:RideVehicle"
626,arafed image of a man standing on a porch with a car,"frame:Posture, frame:BuildingSubparts, frame:People, frame:Awareness, frame:Vehicle, frame:ChangePosture, frame:Placing, frame:BeingLocated"
627,two pictures of a drawing of a man in a bath tub and a woman in a bath tub,"frame:People, frame:BuildingSubparts, frame:Grooming"
634,there is a poster with a picture of a roasting chicken on a plate,"frame:ApplyHeat, frame:Sensation, frame:OpticalImage, frame:Food, frame:Attaching"
637,a close up of a boat on a body of water with ice,"frame:CauseTemperatureChange, frame:Vehicle, frame:PartWhole, frame:InchoativeChangeOfTemperature, frame:Substance"
638,a close up of a person on a ground with a turtle,"frame:People, frame:NaturalFeatures"
640,a cartoon picture of a man with a hat and a belt,"frame:Accoutrements, frame:Sensation, frame:OpticalImage, frame:WorkingOn, frame:People, frame:LaborProduct, frame:CreateRepresentation"
642,dominos with a picture of a man on them sitting on a table,"frame:Posture, frame:Sensation, frame:OpticalImage, frame:People, frame:ChangePosture, frame:Placing, frame:BeingLocated"
644,a close up of a clown doll in a box with a knife,"frame:MeasureVolume, frame:Containers, frame:Weapon"
645,arafed bus on a street with a bridge over it,"frame:Roadways, frame:Vehicle"
648,a close up of a plate with a bowl of food on it,"frame:Food, frame:MeasureVolume"
651,there is a man holding a bottle of beer and a knife,"frame:Food, frame:People, frame:MeasureVolume, frame:Containers, frame:Weapon"
654,arafed baby in diaper holding a drink and a lime,"frame:Clothing, frame:Ingestion, frame:PeopleByAge"
656,three asian women in underwear posing for a picture in a field,"frame:PosingAs, frame:Sensation, frame:OpticalImage, frame:Feigning, frame:Clothing"
657,arafed image of a car with a large wing on it,"frame:Dimension, frame:Awareness, frame:Vehicle, frame:ObservableBodyParts, frame:Size"
658,a woman standing next to a fire with a burning refrigerator,"frame:Posture, frame:Event, frame:CauseTemperatureChange, frame:People, frame:InchoativeChangeOfTemperature, frame:ChangePosture, frame:Placing, frame:BeingLocated"
659,a close up of a person shaving a carrot with a razor,"frame:Motion, frame:Food, frame:People, frame:Removing, frame:Grooming"
668,araff print advert featuring two men walking up stairs,"frame:Cotheme, frame:SelfMotion"
670,a close up of a sign on a train with a picture of a man and a child,"frame:Sign, frame:Sensation, frame:OpticalImage, frame:People, frame:Vehicle, frame:PeopleByAge"
671,a close up of a bottle with a hose attached to it,"frame:MeasureVolume, frame:Containers, frame:RenderNonfunctional"
674,a close up of a leaf on a leopard print background,
675,a close up of a person holding a cigarette in their hand,"frame:Intoxicants, frame:Possession, frame:Containing, frame:People, frame:ObservableBodyParts, frame:Inclusion, frame:Manipulation"
678,arafed image of a car parked in a parking lot at night,"frame:Aggregate, frame:CalendricUnit, frame:Quantity, frame:Awareness, frame:Vehicle, frame:Placing"
681,a poster with a hand holding a bat in it,"frame:Possession, frame:Containing, frame:ObservableBodyParts, frame:Attaching, frame:Inclusion, frame:Manipulation"
682,a close up of a polar bear in the middle of a desert,"frame:PartInnerOuter, frame:BiologicalArea"
683,there is a man and a boy that are sitting on a couch,"frame:Posture, frame:BeingLocated, frame:People, frame:ChangePosture, frame:Placing"
684,a close up of a pair of scissors on a table,frame:Aggregate
685,a close up of a bottle opener on a piece of paper,"frame:Ingredients, frame:Filling, frame:Creating, frame:PartWhole, frame:Substance, frame:MeasureVolume, frame:Containers, frame:Building"
687,a close up of a person with tattoos on their body,"frame:People, frame:PartWhole"
688,there is a black cat that is standing in a frame,"frame:Posture, frame:Color, frame:Animals, frame:ChangePosture, frame:Placing, frame:BeingLocated"
689,a woman walking next to a dinosaur in a desert,"frame:Cotheme, frame:People, frame:BiologicalArea, frame:SelfMotion"
691,a close up of a poster with a string of lights,"frame:Connectors, frame:Attaching"
694,there is a woman with a cigarette in her mouth and a poster with a picture of a man,"frame:Intoxicants, frame:Sensation, frame:ShapedPart, frame:OpticalImage, frame:People, frame:ObservableBodyParts, frame:Attaching"
698,a poster with a black and white image of a bicycle,"frame:Color, frame:Awareness, frame:Vehicle, frame:Attaching"
699,a close up of a shoe with blood on it and a shoelacee,"frame:Clothing, frame:Filling, frame:Placing"
703,arafed man with a toy car in his mouth and a green shirt,"frame:Color, frame:Conduct, frame:ShapedPart, frame:People, frame:ObservableBodyParts, frame:Vehicle, frame:Clothing"
704,there is a man standing in front of a vending machine,"frame:Gizmo, frame:People, frame:PartOrientational, frame:OccupyRank"
706,a close up of a book with a picture of a person in a suit,"frame:Text, frame:Sensation, frame:PartOrderedSegments, frame:OpticalImage, frame:People, frame:Clothing"
709,arafed image of a person skiing down a snowy mountain,"frame:People, frame:Awareness, frame:NaturalFeatures"
711,there is a sign on the wall above a urinal that says take a sip,"frame:Cotheme, frame:Sign, frame:Ingestion, frame:EarningsAndLosses, frame:ArchitecturalPart, frame:ChangeOfLeadership, frame:Conquering, frame:Bringing, frame:Getting, frame:Removing, frame:Taking, frame:ChangeOfQuantityOfPossession"
715,a close up of a wooden sculpture of a woman holding a large block,"frame:PhysicalArtworks, frame:People, frame:Size, frame:Dimension"
716,a close up of a cell phone with a broken screen,"frame:PartInnerOuter, frame:Substance, frame:Contacting, frame:CommunicationMeans"
717,a close up of a cell phone with smoke coming out of it,"frame:Emitting, frame:CommunicationMeans, frame:Arriving, frame:Contacting, frame:Substance"
718,layss print advert featuring a man and woman with food,"frame:Food, frame:People"
719,there is a small pizza with many toppings on a plate,"frame:Size, frame:Dimension"
722,arafed man with a syring in his mouth and a quote about smoking,"frame:ShapedPart, frame:People, frame:ObservableBodyParts"
724,arafed advertisement of a car and a car on a road with a man on a motorcycle,"frame:Roadways, frame:People, frame:Vehicle, frame:OperateVehicle, frame:RideVehicle"
725,someone is drawing a picture of a group of candles on a piece of paper,"frame:Aggregate, frame:Ingredients, frame:Filling, frame:Creating, frame:IntentionallyCreate, frame:CreatePhysicalArtwork, frame:Sensation, frame:Motion, frame:OpticalImage, frame:PartWhole, frame:Substance, frame:CreateRepresentation, frame:Organization, frame:Building"
726,there is a poster with a picture of a bird and a gauge,"frame:Control, frame:ComingToBelieve, frame:Sensation, frame:OpticalImage, frame:Attaching, frame:Contingency"
730,a couple of men are standing around a white bench,"frame:Posture, frame:BeingLocated, frame:Color, frame:ChangePosture, frame:PersonalRelationship, frame:Placing"
736,arafed image of a yellow car driving down a street,"frame:CauseMotion, frame:Color, frame:Roadways, frame:Bringing, frame:Willingness, frame:Vehicle, frame:SelfMotion, frame:Awareness, frame:OperateVehicle, frame:RideVehicle"
744,a close up of a person with a shaved head and a haircut,"frame:People, frame:HairConfiguration, frame:ObservableBodyParts"
746,a poster with a man walking with a walker and a car,"frame:Cotheme, frame:Travel, frame:People, frame:Vehicle, frame:Attaching, frame:SelfMotion"
747,a poster with a sumo wrestler holding a child in his arms,"frame:HostileEncounter, frame:Possession, frame:Containing, frame:Attaching, frame:PeopleByAge, frame:Inclusion, frame:Manipulation, frame:Taking"
751,a poster advertising a bear and a child in lawn chairs,"frame:PeopleByAge, frame:Attaching"
752,a woman in a wheelchair with a pepsi drink on her arm,"frame:ShapedPart, frame:People, frame:ObservableBodyParts, frame:Ingestion"
753,arafed man in a car using a cell phone,"frame:IntentionallyAffect, frame:Using, frame:CommunicationMeans, frame:Contacting, frame:People, frame:Vehicle, frame:Substance"
754,a close up of a roll of paper with a knife on it,"frame:Ingredients, frame:Filling, frame:Text, frame:Substance, frame:Weapon"
755,a vintage advertisement for a milk bar with a child on a limb,"frame:Food, frame:ObservableBodyParts, frame:PeopleByAge, frame:Buildings"
756,a close up of a person with a hand on their chest,"frame:People, frame:ObservableBodyParts, frame:PartWhole"
758,a close up of a lipstick with a yellow top and a silver tube,"frame:Posture, frame:BodyDecoration, frame:Color, frame:Supply, frame:BeingLocated"
761,a close up of a white bra top with a black and white drawing of a woman's,"frame:Posture, frame:Color, frame:Clothing, frame:Supply, frame:BeingLocated"
762,a close up of a cell phone with a black background,"frame:Color, frame:Substance, frame:Contacting, frame:CommunicationMeans"
763,a dark road with trees and a quote on it,"frame:Roadways, frame:Dimension"
764,there is a water tower with a cow on top of it,"frame:BuildingSubparts, frame:PartOrientational, frame:Animals, frame:Substance, frame:Buildings"
765,there is a green object on the sand near a nuclear power plant,"frame:Color, frame:BearingArms, frame:CauseChange, frame:Substance, frame:Weapon, frame:Differentiation, frame:LocaleByUse"
769,a picture of a road with a large crack in the middle,"frame:Dimension, frame:PartInnerOuter, frame:Sensation, frame:OpticalImage, frame:Roadways, frame:Size, frame:CauseHarm"
770,a poster with a bunch of different signs on it,"frame:Aggregate, frame:Attaching"
773,a close up of a person with a hairy face and a brown hair,"frame:Color, frame:People, frame:ObservableBodyParts, frame:HairConfiguration, frame:FacialExpression"
777,arafed man holding a glass of wine in a street at night,"frame:Intoxicants, frame:CalendricUnit, frame:Possession, frame:Containing, frame:People, frame:Roadways, frame:Inclusion, frame:Manipulation, frame:Substance"
778,purple and yellow painted shoes sitting on the ground in front of a wall,"frame:Posture, frame:NaturalFeatures, frame:Color, frame:AboundingWith, frame:PartOrientational, frame:ArchitecturalPart, frame:ChangePosture, frame:Placing, frame:BeingLocated"
780,arafed photograph of a man in a leather jacket leaning against a wall,"frame:Posture, frame:MotionDirectional, frame:PathShape, frame:Representing, frame:People, frame:ArchitecturalPart, frame:Clothing, frame:ChangePosture"
782,two posters of a man holding a cell phone in his hand,"frame:CommunicationMeans, frame:Contacting, frame:Possession, frame:Containing, frame:People, frame:ObservableBodyParts, frame:Inclusion, frame:Manipulation, frame:Substance"
785,arafed pig billboard with three pigs on it on a highway,"frame:Roadways, frame:Animals"
786,a close up of a cell phone with a tomato on it,"frame:Food, frame:Substance, frame:Contacting, frame:CommunicationMeans"
787,cars are lined up on a highway at night with a dark sky,"frame:Locale, frame:Dimension, frame:CalendricUnit, frame:Adorning, frame:Roadways"
788,a close up of a spider on a white background with a blue circle,"frame:Shapes, frame:Color"
791,arafed man walking past a car on a street with a fire in the background,"frame:Cotheme, frame:Event, frame:People, frame:Roadways, frame:Vehicle, frame:SelfMotion"
793,a couple of men walking across a room next to a piano,"frame:Cotheme, frame:BuildingSubparts, frame:SelfMotion, frame:NoiseMakers, frame:PersonalRelationship"
794,a man with a green car sticking out of his mouth,"frame:CauseMotion, frame:Color, frame:ShapedPart, frame:InchoativeAttaching, frame:People, frame:ObservableBodyParts, frame:Vehicle, frame:Attaching, frame:BeingAttached, frame:Placing"
795,a poster with a hand with a painted octopus's face,"frame:AboundingWith, frame:FacialExpression, frame:Attaching, frame:ObservableBodyParts"
796,a poster with a number of different things on it,"frame:Quantity, frame:Attaching"
798,there is a bird that is flying in the sky with its wings spread,"frame:Locale, frame:Motion, frame:Bringing, frame:SelfMotion, frame:OperateVehicle, frame:RideVehicle"
799,a close up of a dinosaur with a sign on it's back,"frame:PartOrientational, frame:Sign"
801,a poster with a man holding a gun and two people holding a bottle,"frame:People, frame:Attaching, frame:MeasureVolume, frame:Containers, frame:Weapon"
803,a close up of a man with a bandage on his face,"frame:People, frame:FacialExpression, frame:ObservableBodyParts"
804,a close up of a man with a lot of bees on his face,"frame:Aggregate, frame:Quantity, frame:People, frame:ObservableBodyParts, frame:FacialExpression"
805,teenagen amiga cover artwork by matto,"frame:WorkingOn, frame:LaborProduct"
811,a close up of a person on a skateboard on a rail,"frame:OperateVehicle, frame:People, frame:ArchitecturalPart"
812,"a poster for the horror movie, the house on the hill","frame:NaturalFeatures, frame:Creating, frame:IntentionallyCreate, frame:BehindTheScenes, frame:ExperiencerObj, frame:Attaching, frame:Fear, frame:Buildings"
813,a close up of a person dipping a tea bag into a cup of tea,"frame:MeasureVolume, frame:People, frame:Containers"
817,an old advertiser advertises a car that has been wrecked,"frame:JudgmentCommunication, frame:Destroying, frame:Bringing, frame:Vehicle, frame:Age, frame:OperateVehicle"
818,a close up of two babies in a suitcase with plastic covering,"frame:Containers, frame:SubstanceByPhase"
822,a close up of a cookie in the water with a white background,"frame:Color, frame:Food, frame:Substance"
824,two cans of soda and a can of soda are shown,"frame:Evidence, frame:Reasoning, frame:CauseToPerceive, frame:Obviousness, frame:MeasureVolume, frame:Containers"
825,a white poster with a man holding a baseball bat and a dog,"frame:Color, frame:People, frame:Animals, frame:Attaching"
826,a close up of a dog pulling a wheelbarrow with pigs in it,"frame:CauseMotion, frame:IngestSubstance, frame:EarningsAndLosses, frame:Motion, frame:BearingArms, frame:Animals, frame:Vehicle, frame:Removing, frame:Manipulation, frame:Containers"
827,a woman in a bikini standing in a field with a dog,"frame:People, frame:Animals, frame:OccupyRank"
828,a close up of a street light with a car driving by,"frame:Roadways, frame:Vehicle, frame:LocationOfLight, frame:Travel"
829,a close up of a skeleton with a book on a table,"frame:Text, frame:PartOrderedSegments"
831,araffe and a bear in a white suit with a beehive,"frame:Color, frame:Clothing, frame:BeingEmployed, frame:LocaleByUse"
835,a close up of a woman in a wedding dress holding a flower,"frame:Clothing, frame:People, frame:Progress"
836,a close up of a white elephant with blue designs on it,frame:Color
840,a close up of a car driving on a road with a lightning in the background,"frame:CauseMotion, frame:Roadways, frame:Bringing, frame:Vehicle, frame:SelfMotion, frame:OperateVehicle, frame:RideVehicle"
842,a man in a cage is swimming next to a shark,"frame:People, frame:SelfMotion"
843,a close up of a bottle of alcohol with a cord attached to it,"frame:Connectors, frame:MeasureVolume, frame:Containers, frame:Intoxicants"
844,three banners with a pig in a car and a pig in a truck,"frame:Animals, frame:Vehicle"
850,arafed water tower with a sign that says eat chicken by the galloin,"frame:Sign, frame:Ingestion, frame:Food, frame:BuildingSubparts, frame:Substance, frame:Buildings"
851,a poster for a boat driving event with a lot of cars,"frame:Aggregate, frame:CauseMotion, frame:Quantity, frame:Event, frame:Bringing, frame:Vehicle, frame:Attaching, frame:SelfMotion, frame:OperateVehicle, frame:RideVehicle"
